{
  "schema_version": "v1alpha1",
  "gate_id": "4fb32cb9-80e2-45de-97ff-7c1781a49149",
  "institution_id": "5d3dca03-89a0-4fb0-99ee-5f39ef5a6f0c",
  "name": "Replay improvement gate",
  "candidate_kinds": ["skill", "review_heuristic"],
  "required_metrics": [
    {
      "name": "duplicate_side_effect_catch_rate",
      "before": 0.62,
      "after": 0.81,
      "direction": "higher_is_better"
    }
  ],
  "min_replay_runs": 1,
  "requires_approval": true,
  "created_at": "2026-04-24T09:05:00Z"
}
